text,sentiment
sound quality great,1
one work either,0
tasty texture nasty,0
best place go tasty bowl pho,1
rbi surprises street sensex pares gains hitting mount,1
shell buy bg group billion takeover,1
complaint standard sound volume little low even turned,0
never hard rock casino never ever step forward,0
although much liked look sound place actual experience bit disappointing,0
chipotle sales plunge troubled chain gets federal subpoena,0
could serve vinaigrette may make better overall dish still good,1
lloyds banking group share price lifts amid reports bank poised axe hundreds uk jobs,1
best found far tried bluetooths one best quality listener well ease using,1
spain caixabank expects close deal banco bpi,1
reaching new depths glencore loss,0
think plan one sure last moto phone,0
companiesactelion shares hit record shire takeover talk,1
thus far visited twice food absolutely delicious time,1
best fish ever life,1
bad reception,0
fries great,1
worthwhile,1
management rude,0
nice headset priced right,1
fda approves nps drug move validating shire takeover deal,1
great choice,1
paying hot dog fries looks like came kid meal wienerschnitzel idea good meal,0
johnson matthey revs clean air drive,1
downside service,0
update steps drive get baxalta talking bln bid,1
warranty problems line put money somewhere else cingular support,0
work,0
tesco set sell kipa giraffe businesses sky news,1
save money item months,0
immediately said wanted talk manager want talk guy shots fireball behind bar,0
looks great strong,1
stocks resume gains rally record crh tullow climb,1
perfect someone likes beer ice cold case even colder,1
voice recognition thru handset excellent,1
cant get software work computer,0
astrazeneca shares climb drug maker ups profits forecasts,1
order correct,0
ca wait go back,1
bp joins forces det norske norway,1
infuriating,0
ca store anything phone numbers sim,0
britain ftse led lower itv william hill,0
fits like glove strong secure durable,1
kept looking time soon become minutes yet still food,0
aberdeen shares slide net outflows accelerate,0
right red velvet cake stuff good,1
bad cause know family owned really wanted like place,0
ordered motorola data cable got well finished working product,1
great food price high quality house made,1
want sandwich go firehouse,1
astrazeneca sells caprelsa rights sanofi unit,1
astrazeneca chases acerta secure next cancer drug winner,1
dropped phone times say even concrete phone still great knock wood,1
works great car charger especially plug two adapters time,1
place overpriced consistent boba really overpriced,0
delicious,1
frozen margaritas way sugary taste,0
feel dining room college cooking course high class dining service slow best,0
love place hits spot want something healthy lacking quantity flavor,1
buffett company reports percent drop earnings,0
conclusion filling meals,1
kept well,1
food average,0
shares bae systems hit high rating upgrade,1
shire share price group releases results,1
drive get,0
boy sucker dry,0
even bmw series fairly quiet trouble hearing person saying,0
copper prices glencore cuts zinc supply,1
hard judge whether sides good grossed melted styrofoam want eat fear getting sick,0
berkshire bought apple stake share filing shows,1
really easy,1
shell billion bg deal meets shareholder skepticism,0
truly awful,0
disgrace,0
hard make decent hamburger,0
stanchart rbs struggle bank england stress tests,0
hsbc posts surprise pretax loss million,0
hate anything goes ear,0
seriously solid breakfast,1
cool phone,1
companiesglencore annual results beat forecasts,1
vomited bathroom mid lunch,0
persimmon share price climbs rise revenue,1
sushi lover avoid place means,0
ribeye steak cooked perfectly great mesquite flavor,1
place like chipotle better,1
classic maine lobster roll fantastic,1
waited thirty minutes seated although vacant tables folks waiting,0
bt headset disapoinment,0
ones make scene restaurants get definitely lost love one,0
croutons also taste homemade extra plus,1
would recommend place,0
would recommend buying product,0
good price,1
plug wrong size,0
sainsbury says outperform rivals tough market,1
ri style calamari joke,0
royal dutch shell posts rise earnings despite lower oil prices,1
managed bend leaf spring back place metal enough stress break next drop,0
stay away q,0
hsbc standard chartered lead asia bank rout votes,0
lately extremely nice helpful phone,1
coming back,0
wo regret,1
best electronics available fm transmitters,1
love fries beans,1
place pretty good nice little vibe restaurant,1
embarassing also ears hurt try push ear plug ear,0
bae systems sales boosted european typhoon currencies,1
asahi could snap sabmiller beers ahead ab inbev sale,1
like return,0
pay hikes year rio tinto mining slump bites,0
update aggreko interim profit drops undertakes restructuring,0
cases would order another,1
dishes salmon best great,1
european stocks hover near low dialog bhp slump,0
also problems phone reading memory card always turn,0
cftc fines barclays inaccurate swaps position reports,0
place honestly blown,0
say plantronics maintains flawless connection cell static normal use,1
uk government cuts stake lloyds pct,0
perfect family meal get together friends,1
fewer hurt sainsbury market share,0
companiesphilips transfers pension obligations,1
could barely stomach meal complain business lunch,0
johnson matthey sells research chemicals unit thermo scientific,1
food sucked expected sucked could imagined,0
wo going back anytime soon,0
finally three four times spring latch broke could use longer visor,0
battery excellent bargain,1
sitting vehicle cradle belt headset lost signal,0
potatoes great biscuit,1
former barclays traders stand trial libor case,0
barclays bank chief step,0
total letdown would much rather go camelback flower shop cartel coffee,0
product clearly ready prime time care cool looks ca tell call coming worthless,0
travis perkins create jobs,1
also ordered spinach avocado salad ingredients sad dressing literally zero taste,0
brother law works mall ate day guess sick night,0
painful ear,0
really like product motorola allot clearer ear piece mic,1
first charge kept going dead minutes,0
muddy low quality sound casing around wire insert poorly super glued slid,0
good product good seller,1
disappointed,0
update flotilla protests shell arctic drilling plans,0
really nice atmosphere,1
much like go back ca get passed atrocious service never return,0
slow seating even reservation,0
astrazeneca share price company carve antibiotic r unit separate,1
must study anyone interested worst sins industrial design,0
insulted,0
nice design quality,1
wo disappointed,1
bg group still happy shell billion offer,1
itv shares dip update,0
kept catching cable seat pull phone turn,0
great hands free device,1
seems like good quick place grab bite familiar pub food favor look elsewhere,0
virgin wireless rocks cheap little phone,1
citigroup sell onemain springleaf billion,1
great deal,1
excited get headset thought really cute,1
worked well,1
glencore sells shares raise billion reduce debt,1
centrica share price british gas fire despite price cut,0
flavorful perfect amount heat,1
none works buy,0
volume switch rocketed unit destination unknown,0
defective crap,0
needless say wo going back anytime soon,0
omg food delicioso,1
looking new earpiece,0
think,0
sprint charges service,0
glencore fight back debt fears lifts shares,1
defeats purpose bluetooth headset,0
buffett berkshire builds deere stake dumps exxon,0
london morning briefing hsbc standard chartered shares rise,1
great jawbone,1
bhp iron ore outlook holds little cheer small miners,0
wolseley helps lift ftse losses,1
network coverage los angeles horrible,0
staff also friendly efficient,1
one table thought food average worth wait,0
accountant know getting screwed,0
camera although rated impressive megapixels renders images fall well expectations relatively high resolution,0
work weeks break,0
expect good,1
drinks weak people,0
piece junk broke phone days,0
unilever continues battle soft demand,0
novartis buys remaining rights gsk treatment deal billion,1
arm royalties accelerate smartphone market regains strength,1
everything perfect night,1
clipping belt deffinitely make feel like cent,1
news feedftse movers ashtead jumps strong interims glencore bp,1
recently tried caballero back every week since,1
commercials misleading,0
barclays bank america citigroup blockchain sight,1
tapas dishes delicious,1
buy buyit sucks,0
great touch,1
could ask satisfying meal,1
one places phoenix would definately go back,1
join club get awesome offers via email,1
berkshire hathaway profit declines percent,0
disappointed,0
companiesmorrison evicted ftse worldpay joins,0
majority logitech earbud headsets failed,0
year battery went completely dead headset,0
steak amazing rge fillet relleno best seafood plate ever,1
want wait mediocre food downright terrible service place,0
busy know,0
bad fit way big,0
great restaurant mandalay bay,1
barclays plc lloyds banking group plc banks buy today,1
waste money,0
fried rice dry well,0
tonight elk filet special sucked,0
worth,0
took one drop inches kitchen counter impressed laughing,0
continue come ladies night andddd date night highly recommend place anyone area,1
pale color instead nice char flavor,0
restaurant always full never wait,1
industry newswolseley confident reslilience amid mixed markets,1
made case small difficult install,0
three different occasions asked well done medium well three times got bloodiest piece meat plate,0
gyro basically lettuce,0
poor construction,0
makes easier keep bluetooth wearing,0
incredible,1
food arrived quickly,1
abn amro bank brought rbs poised return market,1
glencore agrees sell minority stake agriculture business,1
simple little phone use breakage unacceptible,0
car accept cassette,0
thought venture away get good sushi place really hit spot night,1
excellent product satisfied purchase,1
wanted,1
tesco sells half stake ecommerce site lazada alibaba,1
great bluetooth,1
hardly meat,0
food delicious bartender attentive personable got great deal,1
probably would go,0
unusable moving car freeway speed,0
high hopes place since burgers cooked charcoal grill unfortunately taste fell flat way flat,0
passengers rise easyjet aer lingus,1
bother contacting company dollar product learned lesson bought form online anyway,0
waste money,0
barclays credit suisse strike record deals sec ny dark pools,0
morrisons debenhams surprise city christmas bounce back,1
used two days always easy hear,0
point friends basically figured place joke mind making publicly loudly known,0
easyjet attracts passengers june still lags ryanair,1
admiral schroders lift ftse profits surge,1
battery life,0
magical help,1
currency causes headaches sabmiller,0
tesco says uk store closures put jobs risk,0
tesco uk personnel director quits supermarket,0
continue pairing periodically since somehow kept dropping,0
tracfonewebsite user friendly makes easy toactivate etc,1
much seafood like strings pasta bottom,0
jabra eargels fit ears well,1
disappointment,0
around years carries highest quality screen protector found date,1
place clean food oh stale,0
got phone around end may completely unhappy,0
everyone treated equally special,1
loud enough turn like,0
hot dishes hot cold dishes close room watched staff prepare food bare hands deep fried oil,0
falling oil prices hurt hunting weir group,0
great service food,1
loved grilled pizza reminded legit italian pizza,1
pulled car waited another minutes acknowledged,0
setup could simpler,1
dealmakers wrong ignore brexit risk,0
come back every time vegas,1
use product motor control center lot high voltage humming equipment works great,1
design,1
bp shares tumble loss,0
ice said start lining financing lse bidding war,1
genel shares plunge tony hayward oil explorer cuts crude reserves core field,0
teva fda approves generic version astrazeneca heartburn drug,1
salad wings ice cream dessert left feeling quite satisfied,1
shell go ahead petrochemical plant pennsylvania,1
handsfree part works fine car tries download address book treo still rate device high,1
scallop dish quite appalling value well,0
everything fresh delicious,1
yellowtail carpaccio melt mouth fresh,1
quite comfortable ear,1
beach holiday demand helps lift clouds easyjet,1
disgusted pretty sure human hair,0
came running us realized husband left sunglasses table,1
bhp billiton posts big loss slashes dividend,0
best phone market,1
everything worked first device certainly engineered clever way construction feels good,1
phone year tell great,0
never ever go back,0
lloyds wins right buy bonds back early save billion pounds,1
hold phone particular angle party hear clearly,0
know pulled pork could soooo delicious,1
went lunch service slow,0
side cafe serves really good food,1
big disappointment calendar sync,0
phone falls easily,0
standard chartered faces fresh claims iran sanctions violations,0
device great several,1
barclays bonds rise lender cuts dividends shore capital,1
never go back place never ever recommended place anyone,0
went motorola website followed directions could get pair,0
wonderful lil tapas ambience made feel warm fuzzy inside,1
associated british foods profit hit strong sterling tough sugar business,0
atmosphere fun,1
probably wo back honest,0
update rbs must pay mln mortgage bond judge,0
nice solid keyboard,1
update dutch shell pulls plug arctic exploration,0
worst service boot least worries,0
bunzl delivers small profit increase,1
waited waited,0
great place fo take eat,1
randgold resources third quarter profit slips despite record production,0
dealmakers wrong ignore brexit risk,0
diageo sells ryder cup venue gleneagles hotel ennismore group,1
buyer careful,0
everything good tasty,1
bottowm line another worthless cheap gimmick sprint,0
glencore shares rally miner hits back,1
however much garlic fondue barely edible,0
awesome device,1
bad pay month service,0
highly recommended,1
bother coming,0
rbs share price group plans slash jobs,0
hour seriously,0
great brunch spot,1
headset fulfills requirements happy purchase,1
hammerson jv partner secure ownership ireland dundrum quick facts,1
meggitt plc crashes profit warning buy,0
features want,1
love able use one headset cell,1
several times past experience always great,1
took hour get food tables restaurant food luke warm sever running around like totally overwhelmed,0
warren buffett berkshire hathaway quarterly profit jumps almost one third,1
day week different deal delicious,1
mac salad pretty bland getting,0
found product waaay big,0
dressed treated rudely,0
crh concrete bid holcim lafarge assets,1
battery junk,0
love features form factor,1
companiestullow says gas exports key field disrupted,0
people couldnt hear talk pull earphone talk phone,0
,1
small family restaurant fine dining establishment,1
works,1
greenpeace protest bp forces british museum close,0
loudspeaker option great bumpers lights appealing,0
wonderful experience made place whenever town,1
get incredibly fresh fish prepared care,1
great food great service clean friendly setting,1
fda approves nps drug move validating shire takeover deal,1
