text,sentiment
wife lobster bisque soup lukewarm,0
looses connection phone even within couple feet two,0
jamaican mojitos delicious,1
drain,0
barclays million us settlement mutual funds,0
hear driving car usually even put loudest setting,1
aviva fined million regulator fee failings,0
one works priced right,1
find inexcusable probably returning phone perhaps changing carriers,0
place way overpriced mediocre food,0
folks otto always make us feel welcome special,1
portable works,1
pan cakes everyone raving taste like sugary disaster tailored palate six year old,0
several different minute calls experienced drops area bars,0
verizon tech support walked procedures none worked ended hard wiping data,0
love thin,1
overall would recommend phone new walkman,1
good prices,1
battery life still long enough motorola razor,0
would recommend others,0
broker tips rbs croda sage,1
bose noise cancelling amazing important nyc commuter,1
nice blanket moz top feel like done cover subpar food,1
definately enjoyed,1
treo refused replace forced buy another phone without kind upgrade discount,0
staff great food delish incredible beer selection,1
new battery works great phone,1
thing like prime rib dessert section,1
last long,0
back many times soon,1
good hoped,0
heard good things place exceeding every hope could dreamed,1
mine year christmas bought rest family,1
retailers kingfisher sports direct rise britain share index,1
barclays brands financier amanda staveley claim misconceived,0
beware,0
service outshining definitely recommend halibut,1
look authentic thai food go else,0
update rbs must pay mln mortgage bond judge,0
mic work,0
disappointing dinner went elsewhere dessert,0
update see strong earnings outgoing ceo says,1
also difficult put recommend avoiding product,0
could take videos time quality poor,0
uk ftse hits new record highs crh climbs,1
great software motorolas,1
primark racks happy christmas strong sales,1
reaching bottom row uncomfortable send end keys expect,0
volume ringer real good choices loud,1
weir group sees continued fall orders oil gas business,0
also like button felt like would crack use,0
standard chartered close equity sales research business,0
food good,0
first bathrooms location seat covers replenished plain yucky,0
essentially forget microsoft tech support,0
good bargain,0
good quality,1
aberdeen asset management gains foothold china,1
take little bad service food sucks,0
first time going think quickly become regular,1
stars aligned ab inbev megabrew merger plan,1
wasted enough life poured salt wound drawing time took bring check,0
worst customer service ever,0
problem charge sandwich bigger subway sub offers better amount vegetables,0
shropshire mid wales trains hit new strike arriva drivers,0
impressed,0
wear glasses fits fine,1
hope place sticks around,1
first wear well,0
phone also take great pictures even video clips,1
better expect,1
also fries without doubt worst fries ever,0
im az time new spot,1
cocktails handmade delicious,1
essentially communications tool communicate,0
great,1
phone slim light display beautiful,1
salad right amount sauce power scallop perfectly cooked,1
royal dutch shell pulls plug arctic exploration,0
astrazeneca sells us gout drug rights ironwood million,1
highly recommend modest priced cellular phone,1
received supposedly new motorola apparently match phone charger,0
service poor thats nice,0
ordered old classics new dishes going times sorely disappointed everything,0
royal dutch shell buy bg group nearly billion,1
bunzl blames weakness united states revenue slowdown,0
equally awful,0
warren buffett berkshire adds favorites ibm wells fargo,1
satisfied cell phone day one,1
bluetooth weeks really like,1
gkn buy fokker technologies mln euros,1
purcashed car charger work,0
update billiton credit ratings fragile agencies warn,0
ordered voodoo pasta first time really excellent pasta since going gluten free several years ago,1
company joke,0
london open taylor wimpey ashtead drive markets higher barclays falls,1
absolutley fantastic,1
minutes waiting salad realized coming time soon,0
far best cheesecurds ever,1
good food good service,1
sse faces profiteering accusations despite cut gas charges,0
absolutely amazing,1
performed,1
nokia usb cable work phone,0
keep good work amazon,1
glaxosmithkline hails progress lung disease treatment,1
bp statoil withdraw staff algeria following rocket attack,0
hsbc says unit book million charge settlement,0
industry newswhitbread sales sink fourth quarter costa slowdown,0
uk osborne may sell rbs shares loss,0
burger absolutely flavor meat totally bland burger overcooked charcoal flavor,0
press us lawsuit barclays dismissed reuters,1
poor voice clarity,0
jim armitage spare tears glencore bosses paying small price,0
guess maybe went night disgraceful,0
really far probably best bt headset ever,1
dixons carphone profit boost strong sales,1
voice recognition tremendous,1
lasts less minutes actually try use wife phone problem,0
update astrazeneca selumetinib gets orphan drug label good,1
dividends unleashed royal bank scotland group plc,1
good joint,1
rip charge shipping,0
order arrived one gyros missing,0
buy product,0
wo returning,0
waitresses friendly,1
pizza selections good,1
standard chartered rbs escape capital raising stress test,1
make calls certain places,0
mediocre food,0
dessert panna cotta amazing,1
nice leather,1
way expensive,0
single employee came see ok even needed water refill finally served us food,0
bug never showed would given sure side wall bug climbing kitchen,0
looks good picture case huge disappointment,0
choice headset sound good volume good noise cancellation,1
ample portions good prices,1
plus seriously believe worth steep price point,0
possesed get junk idea,0
phone holds charge like new,1
great product fast shipping,1
glencore tells investors track reduce debt barclays,1
glaxo viiv healthcare signs china manufacturing deal desano,1
buy wrongly advertised,0
order,1
staff always super friendly helpful especially cool bring two small boys baby,1
l g fund arm nikko asset management sign bond fund distribution deal,1
astrazeneca chases acerta secure next cancer drug winner,1
worked great,1
screams legit book somethat also pretty rare vegas,1
drive thru means want wait around half hour food somehow end going make us wait wait,0
glencore cuts budget plans divest lonmin,0
really fantastic thai restaurant definitely worth visit,1
european shares fall chinese import data sabmiller soars,1
talk useless customer service,0
british american tobacco accused bribing senior politicians sabotage,0
truly unbelievably good glad went back,1
phone pretty sturdy never large problems,1
additional ear gels provided instructions whatsoever,0
miners meltdown bhp rio tinto sink commodities rout,0
fca bans former rbs libor submitter,0
unwrapped live mile brushfire literally ice cold,0
militants fire rockets algerian gas plant casualties,0
appears actually outperform original battery china came,1
convenient since staying mgm,1
update rejects ab inbev bln takeover approach,0
advise everyone fooled,0
service terrible food mediocre,0
crostini came salad stale,0
basically threw money window nothing,0
selection probably worst seen vegas none,0
companiesaberdeen asset mgt reports consecutive quarterly outflows,0
seated immediately,1
timely shipment quality product,1
got enjoy seafood salad fabulous vinegrette,1
astrazeneca wins fda approval key new lung cancer pill,1
companies announces arrival london ipo,1
obviously problem adhesive,0
loved,1
clicks place way makes wonder long mechanism would last,0
works well,1
got sitting fairly fast ended waiting minutes place order another minutes food arrived,0
waitress good though,1
tesco cut junk moody concern revival take time,0
place awesome want something light healthy summer,1
pizza good peanut sauce tasty,1
bhp billiton lower copper production costs,1
tesco made bit crucial error promotion ramadan,0
best breakfast buffet,1
rio tinto reaffirms goal iron ore output,1
uncomfortable ear use lg env,0
seriously killer hot chai latte,1
much better ayce sushi place went vegas,1
live neighborhood disappointed wo back convenient location,0
swung give try deeply disappointed,0
ftse rallies low boosted stanchart sainsbury,1
profits fall standard chartered plc buy sell,0
house getting dropped coverage upstairs coverage basement,0
good money,0
united utilities fy profit boost capex,1
weird vibe owners,0
watched waiter pay lot attention tables ignore us,0
barclays said cut investment bank mccormick departs,0
wolseley profit warns revenue growth,1
dont think back long time,0
chinese forgeries abound,0
tesco loses two directors garfield tammenoms step,0
contacted company told although unit still warranty could produce receipt luck,0
aviva suspends trading uk property fund,0
sad little vegetables overcooked,0
worth every penny,1
probably one people ever go ians like,0
waiter helpful friendly rarely checked us,0
persimmon sees,1
perfect,1
seriously good pizza topic,1
best luck rude service focused new management,0
staff super nice quick even crazy crowds downtown juries lawyers court staff,1
sweetest phone,1
bp sees earnings slide low oil prices take toll,0
nice sound,1
us sanctions put alliance plans jeopardy,0
glaxosmithkline set complete billion novartis asset swap next week,1
update sells italian branches mediobanca loss,0
trouble accessing internet downloading ringtones performing functions,1
whitbread profit sales continue rise looking new ceo,1
london stock exchange seals billion merger germany deutsche,1
never treated bad,0
first thought grtting good deal plugged phone razr,0
wo try going back even empty,0
hear garbage audio,0
awesome new look fall,1
know place managed served blandest food ever eaten preparing indian cuisine,0
tesco share price jumps sales top estimates,1
good thing fits comfortably small ears,1
waitress friendly happy accomodate options,1
went tigerlilly fantastic afternoon,1
superb,1
petrofac books cost shetland gas terminal delays,0
standard chartered misses estimates sands last results,0
tesco mobile partners unlockd change way consumers use pay mobile phones,1
sound clear people talk amazed quality,1
aims increase dividend ratio pct,1
seller understanding patient would definitely buy,1
astrazeneca heart drug boosted major clinical trial success,1
place fairly clean food simply worth,0
london open taylor wimpey ashtead drive markets higher barclays falls,0
works comfortable,1
great would really recommend,1
anyway think go back,0
tesco pay settle lawsuit accounting scandal,0
sainsbury asda tesco morrisons cut petrol prices oil falls,0
disappointing experience,0
sad,0
capital warren buffett favorite partner deals worth billions,1
problem ear loops made weak material break easily,0
worst salmon sashimi,0
rolled eyes may stayed sure go back try,0
retailers kingfisher sports direct rise britain share index,1
much less jawbone going replace,1
friend like bloody mary,0
spend money time place else,0
performed awful muffled tinny incoming sound severe echo end call,0
razr battery good buy,1
today first taste buldogis gourmet hot dog tell ever thought possible,1
none three sizes sent headset would stay ears,0
astrazeneca profit sales stalwarts fade,0
whole experience underwhelming think go ninja sushi next time,0
great camera thats pics nice clear great picture quality,1
astrazeneca sells us drug rights perrigo mln,1
spain caixabank expects close deal banco bpi,1
useless phone simply deaf,0
came back today since relocated still impressed,0
lloyds cutting jobs shutting branches,0
items stated included description included,0
one bite hooked,1
boyfriend sat bar completely delightful experience,1
obviously terrible customer service get pay,0
hate disagree fellow yelpers husband disappointed place,0
prudential hit withdrawals g investment arm,0
everything product,0
excellent new restaurant experienced frenchman,1
fact going round stars awesome,1
trouble volume,0
astrazeneca says new lung cancer pill tagrisso approved eu,1
han nan chicken also tasty,1
service quick even go orders like like,1
voice quality signal strength dropped calls,0
soggy good,0
used several phone two years one best,1
tesco chief excutive dave lewis sees signs despite profits tumble,1
friendly staff,1
week later activated suddenly died,0
better expected,1
definitely bargain,1
barclays deutsche bank fight lift profit got harder,0
great atmosphere friendly fast service,1
bp judge urged impose spill fine,0
say food amazing,1
item received counterfeit,0
getting angry want damn pho,0
setup went smoothly,1
amazon attack uk grocery market morrisons deal,1
went bachi burger friend recommendation disappointed,1
product costs much one expect work far better greater ease thing,0
really enjoyed crema café expanded even told friends best breakfast,1
update investigator freed early china jail source,1
find wasting food despicable food,0
loved friendly servers great food wonderful imaginative menu,1
find bad unit comes one earpad would recommend anyone,0
place jewel las vegas exactly hoping find nearly ten years living,1
thing disappoint infra red port irda,0
chef generous time even came around twice take pictures,1
us says hsbc must improve compliance,0
update posts net loss hurt shetland islands project costs,0
looking headset long time got could happier,1
stocks resume gains rally record crh tullow climb,1
battery working well replacement original came phone years ago,1
great charger,1
aggravating,0
phone got year old slowly breaking despite much care part,0
place worth time let alone vegas,0
clear crisp sound,1
eu drops shell bp statoil ethanol benchmark investigation,1
glencore cuts budget plans divest lonmin,0
gosh best phone ever,1
sharp blue nice color,1
highly recommend one blue tooth phone,1
like really sexy party mouth outrageously flirting hottest person party,1
tesco leads ftse higher clubcard bid reports,1
buy,0
bought phone replacement startac regretted since,0
easy use,1
intertek profit expects meet forecast,1
soars pct fuelling metals surge glencore cuts output,1
blueant supertooth phone speaker awesome,1
waste money,0
extremely rude really many restaurants would love dine weekend vegas,0
google mediocre imagine smashburger pop,0
dish quite flavourful,1
clear quality sound mess sound ipod since sound buttons headset,1
shipping time also quick,1
beautiful styling though,1
works like works advertised,1
appetite instantly gone,0
asked bill leave without eating bring either,0
comfortable nice range good battery life,1
definitely would eat,0
love go back,1
food quality horrible,0
tesco asda sales fall march discounters continues kantar,0
companiestesco sends supermarket shares top ftse,1
amazon sucks,0
love sushi found kabuki,0
go far many places never seen restaurant serves egg breakfast especially,0
also phone seem accept anything except cbr preferably ripped windows media player,0
barclays said cutting investment bank jobs,0
exchanged sony ericson pretty happy decision,1
chips sals amazing,1
love place,1
ftse steadies around low diageo shares surge,1
similarly delivery man say word apology food minutes late,0
place lacked style,0
clydesdale bank profits weighed ppi charge,0
ocbc buy barclay wealth management unit singapore hong kong,1
britain cuts lloyds banking group stake pct,0
tullow oil eyes lower earnings output falls,0
menu diverse reasonably priced,1
really pleased product far,1
took close minutes come one point,0
service perfect family atmosphere nice see,1
bluetooth range good days ago left phone trunk got call carried conversation without hitch,1
nothing authentic place,0
tried go lunch madhouse,0
nyse owner ice may gatecrash deutsche merger,0
reading please go,0
astrazeneca diabetes drug combination faces delay fda rebuff,0
standard life stands tall amid pension reform,1
eew location needs complete overhaul,0
loved bacon wrapped dates,1
delicious,1
disappointed,0
renewed ab inbev bid sabmiller ups stake beer battle,1
phone slide around car grip prevents phone slipping hand,1
real improvement,0
verizon accused hurting rivals,0
kinder morgan bp form joint venture limited liability company purchase,1
big waste time,0
nachos must,1
battery holding well,1
however girl complain time phone wake like normal phone,0
company shipped product promptly works well,1
wow spicy delicious,1
tesco leads leap ftse marks spencer drops,1
shell fined scottish court north sea oil spill,0
best bluetooth market,1
eargels channel sound directly ear seem increase sound volume clarity,1
love margaritas,1
tesco said discuss central eastern european unit sale,1
sound quality device really quiet area almost hear nothing,0
drain weak snap,0
maybe cold would somewhat edible,0
say bye bye tip lady,0
go store bought new nokia phone working great,1
overall like food service,1
super charged use small hybrid excels roles,1
cool cases open allowing screen get scratched,1
staff friendly joint always clean,1
britain ftse eyes straight daily rise wolseley lags,0
sushi strip place go,1
barclays settles us investors libor manipulation,1
stopped late may bank holiday rick steve recommendation loved,1
service super friendly,1
could figure,0
horizonte acquires neighbouring glencore nickel property brazil,1
ordered albondigas soup warm tasted like tomato soup frozen meatballs,0
chicken pho tasted bland,0
ftse falls low greek debt concerns easyjet skids,0
jabra earset happy sound quality especially outgoing better,1
interesting part town place amazing,1
aggreko says first half profits lower oil price rout claims latest victim,0
everything description said would,1
ha long bay bit flop,0
nearly good looking amazon picture makes look,0
give wirefly contact inform practice,0
said phone camera nice many cool effects play video decent well,1
rbs becomes shadow former self,0
drain player may also potentially fry,0
ab inbev latest bid said unlikely win sabmiller approval,0
received quickly works great,1
tried several different earpieces cell phone jabra one first one found fits ear comfortably,1
shares easyjet fall low brexit profit warning,0
early victory new ceo morrisons beats forecasts,1
clydesdale yorkshire moves closer independence,1
says,0
recently problems could stay connected minutes disconnected,0
lloyds banking group cut jobs close branches,1
thoroughly disappointed,0
happy item,0
buttons small,0
get better reception clarity phone,1
main thing enjoy crowd older crowd around mid,0
ftse slide halted bp us settlement london report,0
purchased within days longer working,0
loved biscuits,1
first thing happened tracking,0
wo ever go,0
believe place great stop huge belly hankering sushi,1
place first pho amazing,1
great food service huge portions give military discount,1
deserves stars,1
asahi could snap sabmiller beers ahead ab inbev sale,1
pros large seating nice bar great simple drink best brick oven pizza homemade dough,1
best customer service anywhere,1
plus bucks,1
purchase different case,0
kind embarrassing use looks mostly embarrassing company,0
product strong smell unbearable caused return,0
fixes problems,1
trend underpins uk sales growth kingfisher,1
far worst purchase made amazon,0
ftse moves lower hsbc outperforms,1
light weight hardly notice,1
way fried,0
aldi lidl expansion plans speed ahead tesco sainsbury morrisons,1
plugged find darn thing worked,0
great dinners,1
clinigen chosen astrazeneca manage access programme next,1
tesco turnaround gathers pace new ceo,1
microphone also works well according people called applifies everything,1
waste money,0
construction headsets poor,0
priceline stock jumps new high year barclays upgrade,1
expected better consumer experience motorola,0
tesco sales deteriorate ahead crucial christmas period,0
daily specials always hit group,1
steer clear product go genuine palm replacementr pens come,0
prudential capital ratio beats forecasts confirms uk head,1
even fully charged went bed turned blue tooth noticed left morning,0
item great installed let charged overnite working good every since problems,1
would return,0
l g still paying price dividend cut crisis chief says,0
companiescar insurer hastings group driving ipo,1
chips salsa really good salsa fresh,1
place great,1
consider theft,0
good protection make phone bulky,1
way plug us unless go converter,0
know made wise decision,1
sainsbury glencore give ftse lift london report,1
dyson wants create hair dryer revolution,1
wontons thin thick chewy almost melt mouth,1
tesco share price brand guarantee comes fire,0
sister one also loves,1
cashew cream sauce bland vegetables undercooked,0
simply want small flip phone look elsewhere extra bells whistles mediocre,0
agrees uk gas pipeline stake sale infrastructur,1
take battery phone put back together restart,0
price amazon excellent product would highly recommend,1
tesco sales recover focus returns core business,1
unfortunately easy accidentally activate buttons accidentally touch phone face listening,0
assure back,1
cool,1
love camera really pretty good quality,1
lse gets hong kong regulatory nod hk firms become lse members,1
better new,1
valeant ceo pledges heed critics painful experience,0
travis perkins hikes dividend profit revenue rise,1
greek dressing creamy flavorful,1
industry newswood group wins dollar contract bp,1
chips came dripping grease mostly edible,0
royal mail share price edges lower group raises stamp price,0
stakes high astrazeneca heart drug facing tough competition,0
least think refill water struggle wave minutes,0
selection menu great prices,1
owned phone months say best mobile phone,1
update semiconductor offers buy integrated silicon solution,1
astrazeneca share price acerta deal pays orphan drug status,1
britain ftse advances royal mail rises,1
shropshire mid wales trains hit new strike arriva drivers,0
good works fine,1
hargreaves lansdown share price falls costs mount although pensions,0
closely watched astrazeneca cancer drug fails mesothelioma,0
stocks little changed near record barclays shell fall,0
must night place,0
burgers amazing,1
fantastic buy get whatever next phone,1
side town definitely spot hit,1
fastjet slams easyjet founder stelios going public taking legal advice letter contractual,0
us seeks huawei records dealings sanctioned nations,0
astrazeneca us anaesthetic deal,1
using iriver spinn case fits fine,1
things went wrong burned saganaki,0
far good,1
grilled chicken tender yellow saffron seasoning,1
fits ear well comfortable,1
good case,1
cooked perfection service impeccable,1
mega pixel camera part phone reasonably,1
group claimed would handled us beautifully,1
unreliable service,0
authentic leather nice shine comfort recommend case,1
diageo sales disappoint currency comparatives leave bitter taste,0
place deserves stars,0
lived since first last time stepped foot place,0
nargile think great,1
certainly comfortable functionality decent,1
ambiance incredible,1
never got,0
kingfisher takeover mr bricolage could hit brick wall,0
packed,0
con spotty service,0
barclays deutsche bank fight lift profit got harder,0
make mistake,0
earnings surge fund manager schroders reports record year,1
bad lost heart finish,0
talk great customer service course back,1
astrazeneca bags another cancer drug deal time inovio,1
product useless since enough charging current charge cellphones planning use,0
saudi aramco shell plan break motiva divide assets,1
sorry made purchase,0
food good enjoyed every mouthful enjoyable relaxed venue couples small family groups etc,1
excellent starter wireless headset,0
pleased headset,1
insults profound deuchebaggery go outside smoke break serving solidify,0
two seperated mere ft started notice excessive static garbled sound headset,0
aldi lidl expansion plans speed ahead tesco sainsbury morrisons,1
places eat circumstances would ever return tops list,0
prices reasonable flavors spot sauce home made slaw drenched mayo,1
would avoid place staying mirage,0
ground right next table large smeared pile green bird poop,0
zero stars would give zero stars,0
thanks amazon things need good price,1
accompanied software almost brilliant,1
bit disappointed,0
extremely tasty,1
crisp clear,1
shire buy nps billion boost rare disease drugs,1
barely ever hear constantly saying,0
worst sushi ever eat besides costco,0
morrisons book second consecutive quarter sales growth,1
unfortunately must hit bakery leftover day everything ordered stale,0
unilever posts fourth quarter,0
started tuna sashimi brownish color obviously fresh,0
kids play area nasty,0
food good,1
phone takes forever charge like hours literally,0
great deal,1
britain ftse steadies supported dixons carphone,1
companieslord livingston joins dixons carphone,1
also decided send back waitress looked like verge heart attack,0
news feedftse movers lse surges ice says mulling offer ashtead barclays tank,0
krussel always good,1
internet excrutiatingly slow,0
chicken wings contained driest chicken meat ever eaten,0
pearson lags uk ftse slips record high,0
blue ant easy use,1
even take self portraits outside exterior display cool,1
fiancé came middle day greeted seated right away,1
drugmaker shire buy baxalta billion pursuit,1
companiesmetro bank raises ahead london listing,1
one note ventilation could use upgrading,0
looks nice,1
service friendly inviting,1
highly recommend encourage people give try,1
also makes easier hold,1
hilarious yummy christmas eve dinner remember biggest fail entire trip us,0
companiespound boost abf mixed impact ahead,1
earpiece large heavy keeps falling ear,0
put latest os likes slow crawl lock every,0
know kind best iced tea,1
love colors,1
update start selling remaining royal mail shares,0
intercontinental exchange opts bid london stock exchange,0
excellent bluetooth headset,1
good though,1
earlier review noted plug charger nothing happens,0
guess known place would suck inside excalibur use common sense,0
selection food best,0
never know pushed hard enough right number times function want,0
service prompt,1
