text,sentiment
well made easy access phone handy detachable belt clip,1
however keypads tinny sometimes reach wrong buttons,0
case seems well made,1
morrisons helps ftse edge higher energy shares slip,1
pretty good beer selection,1
tried talking real loud shouting telephone gets old still told great,0
britain ftse steadies record high bhp gains,1
horrible,0
bought use kindle fire absolutely loved,1
domino pizza worker sacked crude slur aimed customer order screen,0
european shares plunge roiled bhp oil hopes turn ecb,0
girlfriend veal bad,0
eu drops shell bp statoil ethanol benchmark investigation,1
ambience perfect,1
latest buffett says cuts pay kraft heinz,1
hammerson jv partner secure ownership ireland dundrum quick facts,1
sound quality good functionality awesome,1
oil giant shell cut around jobs amid bg takeover,0
attractive appears good quality,1
would given star able,0
astrazeneca medimmune inks licensing deal omnis pharmaceuticals,1
recommend igo anyone different brand cell players family,1
service stinks,0
camera phone may used dustpan indoors rather using disposable,0
good time,1
low quality,0
call steakhouse ca properly cook steak understand,0
product ideal people like whose ears sensitive,1
intercontinental hotels global room revenue lags estimates,0
meggitt agrees buy us aerospace component firm million,1
works great,1
fantastic earphones,1
bp restore lost luster,0
want healthy authentic ethic food try place,1
ftse ends lower weaker miners tesco outperforms,1
investors move bln euros assets axa fund arm,0
diageo sells wine businesses pounds,1
waste money time,0
news feedftse movers standard chartered lifted astrazeneca sinks,1
still maintain monkeys make headphones obviously share enough dna copy design humans,0
pearson forecasts rising earnings reorganization pays,1
protects phone sides,1
last night second time dining happy decided go back,1
thank great service,1
update applies boost wells fargo stake pct,1
tasted like dirt,0
warm beer help,0
poor service,0
stopped place madison ironman friendly kind staff,1
stanchart rbs struggle bank england stress tests,0
arm holdings plc partners international business machines drive,1
works great cat attacked phone scratched protective strip instead destroying screen,1
product exactly described,1
companiestesco sheds harris hoole coffee shops,1
bp cuts capex third time year deal weak oil,0
lot websites rating good phone,1
update fined lax crime checks century,0
update procedure difficult cumbersome,0
avoid cost,0
bucks head really expect better food,0
could get strong enough signal,0
several dozen several hundred contacts imagine fun sending one one,0
itv share price jumps report comcast nbcuniversal bidding takeover,1
dinner companions told everything fresh nice texture taste,1
best headset used,1
companiescompass serves half year profit rise,1
also area unit broke fond magnetic strap,0
much flavor poorly constructed,0
fries hot neither burger,0
however recent experience particular location good,0
thing think could improve sound leaks headset,0
retail focus helps shield lloyds banking chill,1
disbelief dish qualified worst version foods ever tasted,0
update back second time still amazing,1
waitress sweet funny,1
best rotating feature helpful,1
ab inbev sell peroni grolsch,1
gave trying eat crust teeth still sore,0
reversible plug works great,1
ordered toasted english muffin came untoasted,0
one best bars food vegas,1
bought two neither charge,0
would recommend,1
came verizon cingulair nicer cell phones first thing noticed really bad service,0
impressed would recommend item anyone,0
unilever returns cuba joint venture state,1
easyjet traffic hit air traffic controller strikes terrorism,0
trlpc crh backs lafarge holcim asset buy bln euro bridge loan,1
roast beef sandwich tasted really good,1
saggy floppy piece junk,0
great new packaged nice works good problems came less time expected,1
simple use like,1
look sharp screen nice clear great graphics,1
update potassium drug delayed manufacturing snag,0
phone might well worst ever brand,0
food came disappointment ensued,0
great earpiece,1
dave lewis admits long road ahead tesco recovery,0
struggling morrisons pays sacked boss dalton philips,0
got phone reccomendation relative glad,1
close house affordable prices good food,1
honeslty taste fresh,0
waited hours never got either pizzas many around us came later,0
kids pizza always hit lots great side dish options kiddos,1
aldi lidl expansion plans speed ahead tesco sainsbury morrisons,1
pretty awesome place,1
going eat potato found strangers hair,0
think would hold securly belt,0
mobile phone tools must,1
never come,0
deal good enough would drag establishment,0
got home see driest damn wings ever,0
burgers good pizza used amazing doughy flavorless,0
chicken deliciously seasoned perfect fry outside moist chicken inside,1
wanted,0
know slow,0
market report aviva tops market traders approve choice friends,1
aggreko profit declines quick facts,0
chicken chicken caesar salad,1
either cold enough flavor bad,0
worst,0
bp signs billion energy deal egypt,1
verizon accused hurting rivals,0
refried beans came meal dried crusty food bland,0
arrived quickly much less expensive others sold,1
buy product fails,0
great phone,1
sales boost new morrisons chief david potts tesco turnaround stalls,0
chicken dishes ok beef like shoe leather,0
piece junk,0
addition feels amp looks phone lightweight cheap plastic,0
cant go wrong food,1
rbs warns higher misconduct charges obstacles ahead,0
may say buffet pricey think get pay place getting quite lot,1
barclays share price subdued bank faces fresh forex probe,0
sainsbury pressed raise bid home retail group,1
update expects grow year solid end,1
beans rice mediocre best,0
fabulous,1
host staff lack better word bitches,0
promise wo disappoint,1
worked well paired treo skype headset pc using usb bluetooth transceiver,1
ngage still lacking earbuds,0
att clear sound distorted yell talk,0
sainsbury asda tesco morrisons cut petrol prices oil falls,0
great pocket pc phone combination,1
rio tinto announces expansion mongolia mine,1
able voice dialing car problem,1
wish could return unit get back money,0
trying return refund,0
well im satisfied,1
standard chartered shares plunge fitch downgrade,0
london stock exchange seals billion merger germany deutsche,1
big account wins keep ad group wpp front pack,1
bit sweet really spicy enough lacked flavor,0
verizon years ago really liked service,1
industry newspetrofac secures north sea contract,1
poor reliability,0
asked multiple times wine list time ignored went hostess got one,0
great item,1
phone sounded ok great ok wife phone almost totally unintelligible could understand word said,0
dit work time nokia,0
worst phone ever,0
amazed quick arrival two original lg cell phone batteries fraction price,1
trading expertbroker recommendationsubs ups rbs coverage uk banks,1
marketsproperty stocks pressure standard life fund move,0
good case excellent value,1
britain ftse bounces back mondi barratt lead,1
love headset,1
would recommend,1
royal dutch shell buy bg group nearly billion,1
every thing phone work perfectly like,1
astrazeneca medimmune inks licensing deal omnis pharmaceuticals,1
experian says receives class actions related breach,0
staff spends time talking,0
lobster bisque bussell sprouts risotto filet needed salt course none tables,0
lunch great experience,1
problem item would order needed,1
protesters gather seattle block access shell oil rig,0
macarons insanely good,1
thing,0
rotating beers tap also highlight place,1
two former barclays traders face retrial libor,0
price think place would much rather gone,0
bunzl backs view buys businesses,1
ihg agrees sale intercontinental hong kong,1
display excellent camera good year,1
regular toasted bread equally satisfying occasional pats butter mmmm,1
marketsshire baxalta deal,1
tesco sells half stake ecommerce site lazada alibaba,1
bilfinger industrial services win bp contract extension,1
practically useless add kind boost reception bought,0
mcewan nursing rbs struggles yet,0
great sound service,1
persimmon revenues lifted confidence,1
three broke within two months use,0
razr owner must,1
good stuff price,1
piece trash,0
much better hard plastic cases,1
fantastic neighborhood gem,1
impressed going original battery extended battery,1
first crawfish experience delicious,1
gkn buy fokker technologies mln euros,1
ge sell majority stake bank bph core bank alior bank,1
finds cell phone right away enter car,1
really vegas fine dining used right menus handed ladies prices listed,1
uk regulators license bat medicine,1
well made fits surefire perfectly,1
shire rises dry eye treatment sails trial,1
companiesuk government lines lloyds retail share sale,0
stars brick oven bread app,1
update tinto sell aluminium assets bln deal,1
heart attack grill downtown vegas absolutely excuse restaurant,0
least passed us ordering food arriving busy,0
easy pair samsung cell,1
horrible waste time money,0
marketsmoneysupermarket slides barclays brexit warning,0
britain ftse gains land securities dividend hike,1
food great always compliments chef,1
give thumbs,0
experian says receives class actions related breach,0
work cell phone plug set charger,0
poorly contstruct hinge,0
building seems pretty neat bathroom pretty trippy would eat,0
works great,1
buffett berkshire delivers profit growth,1
fears primark growth starting falter,0
despite hard rate businesses actually rare give star,0
unfortunately good,0
poor product,0
osborne extends lloyds plan,0
unfortunately set us disapppointment entrees,0
happy product,1
tesco torn apart watchdog finds supermarket repeatedly withheld payments suppliers,0
new fav vegas buffet spot,1
work europe asia,0
great double cheeseburger,1
good value great food great service,1
london stock exchange shareholders approve merger deutsche,1
audio quality poor poor,0
associated british foods helps ftse rebound,1
arguing verizon regarding dropped calls returned phones two days,0
fast service,1
pretty cool would say,1
restored phone like new performance,1
iam pleased purchase,1
first time might last,0
glencore sells agri unit stake billion canadian pension fund,1
nice headphones price work great,1
give try happy,1
poor service waiter made feel like stupid every time came table,0
trouble brewing legal general group plc aviva plc,0
four bankers sentenced roles libor scandal,0
british taxpayers stake lloyds falls percent,0
satisifed,1
picture resolution far phones offering today,0
back,0
standard life hit number calls pension freedoms,0
exclusive britain targets sale half rbs stake two years sources,0
bother go store,0
iag closes aer lingus increased offer,1
worst phone ever months,0
one better buffets,1
go back next trip,1
astrazeneca pay inovio million cancer drug,1
owners super friendly staff courteous,1
standard chartered slash costs profits plunge,0
great phone,1
everything fine reasonable price,1
get extra minutes carry call get cut,1
talktalk hires bae systems investigate cyber attack,1
compass group says positive year ahead,1
love bluetooth headset great reception good ear piece comfortable fit,1
aspen buy anaesthetics astrazeneca million,1
plays louder speaker size price low would think quality lacking however,1
potato chip order sad could probably count many chips box probably around,0
spicy perfect actually,1
definitely turn doubt back unless someone else buying,0
tesco rebounds buyers sense bargain,1
reed elsevier shares cool profit dip,0
nice ambiance,1
bathrooms clean place well decorated,1
ear loop needed tiny sound great,1
made sturdy,1
nearly years worked great,1
worth drive,1
couple months later returned amazing meal,1
astrazeneca good deal turns bad,0
nano stated son dissapointed,0
sprint terrible customer service,0
seriously flavorful delights folks,1
imi posts drop organic revenue warns full year,0
china cnpc unveil oil alliance sources,1
seasonal fruit fresh white peach puree,1
please stay away shrimp stir fried noodles,0
companiesrbs pulls surprise jump profits,1
worthless product,0
owners really really need quit soooooo cheap let wrap freaking sandwich two papers one,0
absolutely great,1
checked place couple years ago impressed,0
brewer ab inbev seeks bln sabmiller,1
superb phone great network,1
nyse owner ice considers offer lse,1
good enough price,0
great case price,1
refuse refund replace,0
love cable allows connect device pc,1
aviva weighs cash handout beating profit forecast,1
much disappointed company,0
hsbc hit fresh details tax evasion claims,0
old mutual sales buoyed emerging markets,1
servers pleasant deal always honor pizza hut coupons,0
well packaged arrived time works intended,1
exactly wanted,1
waste money time,0
glaxosmithkline share price slips fda okays asthma therapy adults,0
great audio,1
horrible horrible protector,0
new york says barclays cooperating pool probe,0
battery life real good,1
bbcn bancorp buy wilshire bancorp bln deal,1
trading expertbroker recommendationsanalysts mostly negative aberdeen see value,0
britain ftse rises led glencore surge,1
japan nikkei lands financial times billion deal,1
back,1
former schroders trader sentenced years prison,0
also slim enough fit alarm clock docking station without removing case,1
delivery time,1
fun experience,1
marketsus industrials lag barclays dims view,0
excellent headset,1
sergeant pepper beef sandwich auju sauce excellent sandwich well,1
hands favorite italian restaurant,1
got food poisoning buffet,0
far worked like charm,1
bp agrees penalty oil spill tricky science behind,0
fda approves shire vyvanse disorder,1
traders sentenced six years jail libor case,0
extremely crumby pretty tasteless,0
bought hoping could make bluetooth headset fit better things made impossible wear,0
shell challenges exxon dominance bid bg,1
convenient simple use gets job done makes car ride much smoother,1
happy product,1
go gave star rating please know third time eating bachi burger writing review,0
rbs barclays shares temporarily suspended amid heavily losses,0
got aluminum case new palm vx worked really well protected handheld perfectly far,1
itv strike broadcaster revenue soars staff walkout piece action,1
would recommend item,1
stanlife leads ftse strong earnings,1
easy use,1
freezes,0
barclays hit record fine six banks settle forex scandal,0
hsbc preparing job cuts may target workers sky says,0
take min pancakes eggs,0
shower area outside rinse take full shower unless mind nude everyone see,0
hate things much cheap quality black olives,0
seems completely secure holding belt keeping iphone inside,1
tied charger conversations lasting problems,0
euro zone qe helps standard life funds boost,1
hargreaves lansdown says assets hit stock market flux,0
never going back,0
bp pay investors gulf spill claims,0
warning buy,0
outstanding little restaurant best food ever tasted,1
item fantastic works perfectly,1
astrazeneca cancer drug may fast getting market,0
want first say server great perfect service,1
terrible product waste money,0
oh forgot also mention weird color effect phone,0
standard life slips greek worries peg back britain ftse,0
logitech bluetooth headset,1
fitch citi reports much improved results,1
great phone,1
item arrived quickly works great metro pcs samsung slider phone sony premium sound ear plugs,1
exxon beaumont cdu overhaul slowed accident sources,0
gabon considering back tax penalties royal dutch shell,0
reception terrible full static,0
never bland food surprised considering article read focused much spices flavor,0
broker tips rbs croda sage,1
awesome,1
comfortable ear,1
ftse movers bg group leads charge resource stocks jump,1
sorry getting food anytime soon,0
gone go,1
overall psyched phone appointments contacts gets great reception,1
sports direct shares tumble founder ashley sells shares,0
product great makes working lot easier go copier waiting hold something,1
receiving using product days broke,0
waited forty five minutes vain,0
bad day low tolerance rude customer service people job nice polite wash dishes otherwise,0
place quality sushi quality restaurant,0
manager worst,0
works great,1
earbud piece breaks easily,0
particular model would work motorola q smartphone,0
teva net rises amid mylan takeover battle,1
pda rocks,1
want money back,0
sound quality excellent well,1
battery completely useless,0
glaxo sees hope respiratory drugs earnings beat estimates,1
former aviva investors analyst mothahir miah banned fined fca,0
glencore blames rivals creating metals glut,0
vanilla ice cream creamy smooth profiterole choux pastry fresh enough,1
phone tries hard everything fails ability phone,0
astrazeneca bags another cancer drug deal time inovio,1
love phone handy lot features,1
company femsa acquire ades beverage business unilever,1
tesco sale asia biggest deal,1
never go,0
cute quaint simple honest,1
favorite place town shawarrrrrrma,1
sooooo good,1
everything need could ask,1
novartis buys remaining rights gsk treatment deal billion,1
comes strong light use light camera shots even flash sos signals seriously,1
companiestravis perkins lifts dividend earnings rise,1
decor nice piano music soundtrack pleasant,1
check,1
works good,1
great place eat,1
mom got home immediately got sick bites salad,0
thank wasting money,0
reasonably priced also,1
glencore chief blames rivals overproduction share price fall,0
bluetoooth headset time still comfortable way fits ear,0
bars vegas ever recall charged tap water,0
cant say enough good things place,1
user friendly,0
waitress manager friendly,1
service slow attentive,0
know sounds funny seemed like sketchy technology would work one works great,1
staff great ambiance great,1
astrazeneca buy zs pharma billion,1
allows possibility double booking date time first,0
bp fine oil spill capped billion,0
spaghetti nothing special whatsoever,0
companieskingfisher bid mr bricolage runs trouble,0
great using home stereo,1
back good bbq lighter fare reasonable pricing tell public back old ways,1
itv pursue takeover canada entertainment one bloomberg,1
astrazeneca sells rights anaesthetics south africa aspen,1
easyjet attracts passengers june still lags ryanair,1
waste,0
anyway fs restaurant wonderful,1
kingfisher set open another screwfix stores,1
hell go back,0
astrazeneca suffers setback drug fails treat eye cancer,0
really disappointed charger work,0
love decor chinese calligraphy wall paper,1
update sells italian branches mediobanca loss,1
balfour beatty plc set reinstate dividend rival national grid plc centrica plc,1
also took forever bring us check asked,0
good wearing hat sunglasses,0
food bad enough enjoy dealing world drunk people,0
never insulted felt disrespected,0
real sushi lovers let honest yama good,0
hargreaves lansdown bucks weak markets see assets rise percent,1
good item low price,1
love product,1
food way overpriced portions fucking small,0
companiesunilever sales lifted ice cream soft economy,1
igo chargers tips really great,1
reason eat would fill night binge drinking get carbs stomach,0
nicest restaurant owners ever come across,1
nothing privileged,0
could use unit sunglasses good texas,0
vegetables fresh sauce feels like authentic thai,1
waiter attentive friendly informative,1
plantronics bluetooth excelent buy,1
drugmaker shire buy baxalta billion pursuit,1
really nothing bad say headset,0
fits securely ear hook even need used sound better directed ear canal,1
never brought salad asked,0
internet access fine rare instance worked,0
extensive menu provides lots options breakfast,1
huge design flaw unless using correctly think case,0
know like restaurants something,0
rio tinto swings loss drops dividend policy,0
hoping,0
food delicious spicy enough sure ask spicier prefer way,1
good going review place twice hereas tribute place tribute event held last night,1
hargreaves weathers torrid isa season brexit fears,0
greedy corporation never see another dime,0
displeased,0
come hungry leave happy stuffed,1
bought wired headphones sound better,0
uk winners losers aviva friends life lead ftse gainers,1
gsk reveals strong trial results shingles drug,1
searched internet found one best value,1
national grid pretax profit rises percent,1
lady table next us found live green caterpillar salad,0
worth driving tucson,1
mains also uninspired,0
definitely come back,1
lordy khao soi dish missed curry lovers,1
tesco close remaining homeplus stores uk,0
bacon hella salty,1
bathroom next door nice,1
right mind gon na buy battery,0
shocked signs indicate cash,0
shell profit rises company resist oil slump,1
good phone,1
place horrible way overpriced,0
london morning briefing hsbc standard chartered shares rise,1
smith nephew trading profit beats expectations,1
food terrible,0
great problems,1
headset works,1
reception generally good,1
perhaps caught night judging reviews inspired go back,0
nine banks including barclays citi agree pay billion settle forex,0
fly apple fly,0
excellent sound battery life inconspicuous boot,1
said mouths bellies still quite pleased,1
times bad customer service,0
want clip going top ear causing discomfort,0
update easyjet passenger numbers aer lingus traffic february,1
commentopening quote pay day moans profits slump lloyds mars mission,0
breakfast perpared great beautiful presentation giant slices toast lightly dusted powdered sugar,1
unfortunately recharge iphone despite connecting multiple power sources imac external battery wall outlet etc,0
tesco versus sainsbury bodybuilder,1
brought fresh batch fries thinking yay something warm,0
like final blow,0
one thing hate mode set button side,0
nice docking station home work,1
burger got gold standard burger kind disappointed,0
uk serious fraud office seeks retrial two former barclays libor traders,0
really sure joey voted best hot dog valley readers phoenix magazine,0
service also cute,1
hate earbugs avoid phone means,0
liked patio service outstanding,1
bp slashes capital spending,0
take picture battery drops bar starts beeping letting know dieing,0
inbev increases offer rival sabmiller,1
astrazeneca wins us approval longer use blood thinner,1
yes shiny front side love,1
disappointed decision,0
average phone bad battery life operates weak network,0
centrica extends gas deals gazprom statoil,1
eurozone bank lending continues recover slowly barclays says,1
simple lightweight great fit,1
battery quite long,1
long lasting battery recharge frequentyly flip phones,0
chipolte ranch dipping sause tasteless seemed thin watered heat,0
excellent service,1
update settles oil claims halliburton transocean,0
aberdeen raise mln stg seed new funds,1
happy,0
yet run new battery two bars three days without charging,1
glad purchased,1
everything menu terrific also thrilled made amazing accommodations vegetarian daughter,1
great place eat reminds little mom pop shops san francisco bay area,1
price reasonable service great,1
ryan bar definitely one edinburgh establishment wo revisiting,0
food barely lukewarm must sitting waiting server bring us,0
terrible management,0
battery lasts hours,0
descriptions said yum yum sauce another said eel sauce yet another said spicy mayo well none rolls sauces,0
disappointed,0
eli lilly lly broken new high astrazeneca collaboration,1
sainsbury asda tesco morrisons cut petrol prices oil falls,0
sophos aims raise london ipo,1
best charger seen market yet,1
oil majors like royal dutch shell chevron bp fail find reserves counter,0
placed treo case snug lot extra room sides,0
found product easy set use,1
companiestesco sheds harris hoole coffee shops,1
gave stars giving stars,1
omelets die,1
watched prices inflate portions get smaller management attitudes grow rapidly,0
linksys way exchange bad phone refurb unit something,0
utter sound quality terrible,0
industry newsrevenue earnings take tumble weir group,0
ca beat price,1
service fair best,0
really want make experience good one,1
jerks phone,0
gsk joins china trade push uk trumpets healthcare deals,1
literally sat minutes one asking take order,0
sports direct boss mike ashley summoned westminster questioning treatment workers,0
food outstanding prices reasonable,1
place lot promise fails deliver,0
merkel government said support deutsche merger,1
case less extra originally put later discarded scratched ear,0
bhp billiton share price brazil sue samarco,0
deal included tastings drinks jeff went beyond expected,1
unbelievable bargain,1
take business dinner dollars elsewhere,0
chow mein good,1
fit,0
excellent phone,1
total brunch fail,0
astrazeneca talks buy cancer drug developer acerta pharma,1
jiggle plug get line right get decent volume,0
britain ftse buoyed admiral building sector gains,1
familiar check,1
uk chip designer arm hits high iphone boost,1
love great armband,1
update barclays win dismissal us trading case,1
considering two us left full happy ca go wrong,1
ca beat,1
shire ceo steps drive get baxalta board talking,1
news feedschroders books solid earnings growth several board changes,1
based service received effort show gratitude business wo going back,0
first phone cheaply made,0
place,1
mic joke volume quite low,0
fantastic service pleased atmosphere,1
sure long stood long enough begin feel awkwardly place,0
usually like headbands one lightweight mess hair,1
severn trent profit customer complaints fall,1
ordered burger rare came done,0
smith nephew recalls components,0
food great serivce,1
buy want use holster,0
sainsbury sells unit lloydspharmacy,1
one favorite purchases ever,1
questor share tip mondi shares jump strong start,1
waited waited waited,0
seafood limited boiled shrimp crab legs crab legs definitely taste fresh,0
meat pretty dry sliced brisket pulled pork,0
barclays considers acquisition help split retail arm,1
always used corded headsets freedom wireless helpful,1
good product well made,1
phone loads super,1
burger good beef cooked right,1
aviva expects jobs cuts friends life deal,1
glencore shares hit high refinancing key credit line,1
food gooodd,1
great pizza salads,1
