text,sentiment
anyways food definitely filling price pay expect,0
shire buy nps billion boost rare disease drugs,1
say would hardest decision honestly dishes taste supposed taste amazing,1
wind completely useless,0
marketsubs goldman sachs cut metals forecasts,0
shares extend rebound second day easyjet surges,1
many words say place everything pretty well,1
burrittos blah,0
us dollar wipes sales gains sabmiller,0
fca set fine lloyds record ppi,0
made drive way north scottsdale one bit disappointed,1
recommend unless car breaks front starving,0
cutouts buttons placed perfectly,1
work people hear talk,0
absolutely problem headset linking blackberry curve,1
place disgusting,0
place good,1
general retirement business books billion stg sales,1
always order vegetarian menu dinner wide array options choose,1
london stock exchange shareholders vote merger deal brexit cloud,0
worse humiliated worker right front horrible name callings,0
great reception time,1
would reccommend,0
companiescentrica shares drop amid capital raise,0
eu drops shell bp statoil ethanol benchmark investigation,1
service par either,0
bp joins forces det norske norway,1
wo go back,0
linked phone without effort,1
great product price,1
however bt headsets currently good real time games like shooters since audio delay messes,0
trader johnson pleaded guilty libor fixing,0
overpriced getting,0
thumbs,1
ftse ends higher group leads strong earnings,1
always pleasure dealing,1
said useless,0
needless say wasted money,0
every time eat see caring teamwork professional degree,1
love phone,1
uk sells lloyds bank stake billion pounds raised far,0
joy use,1
turnaround buys bhp billiton plc home retail group plc,1
waited hour breakfast could done times better home,0
noise shield incrediable,1
shrimp tender moist,1
steaks recommended,1
two bites refused eat anymore,0
tesco sales rise shows tentative recovery continues,1
side greek salad greek dressing tasty pita hummus refreshing,1
amazon grocery deal morrisons beginning,1
diageo offloads major wine interests,0
presentation food awful,0
fit palm tungsten broke first time tried plug,0
lloyds banking group eyes return dealmaking mbna bid,1
disappointed battery,0
ab inbev approaches sabmiller explore,1
excellent,1
sure order dessert even need pack tiramisu cannoli die,1
buttons bad,0
bidders abandon auction tesco data unit,0
nothing special,0
plan use car forget,0
ordered appetizer took minutes pizza another minutes,0
monster chicken fried steak eggs time favorite,1
quite satisfied purchase,1
shire says internal synergy goals baxalta deal higher,1
desserts bit strange,0
many people complained found headset microphone weak,0
love authentic mexican food want whole bunch interesting yet delicious meats choose need try place,1
mistake,0
keep getting better better third one numerous palms,1
fresnillo production surges profit hit lower prices,1
different cut piece day still wonderful tender well well flavored,1
think restaurant suffers trying hard enough,0
turkey roast beef bland,0
best place vegas breakfast check sat sun,1
excellent hands free tool,1
plug work well,0
old nokia tracfone holds charge lot better,0
eurocrat left unravel london stock exchange deal,0
service give stars,0
could recommend,0
food good service good prices good,1
warren buffett berkshire hathaway buys stake apple,1
gotten much better service pizza place next door services received restaurant,0
proven dead wrong sushi bar quality great service fast food impeccable,1
far sushi connoisseur definitely tell difference good food bad food certainly bad food,0
shire proposes bln baxalta,1
use smallest earpieces provided stays pretty well,1
file browser offers options one great,1
adapter provide enough charging current,0
service little slow considering served people servers food coming slow pace,0
server great job handling large rowdy table,1
third cheese friend burger cold,0
would go back,0
first reception sucks never bars ever,0
itv merger reports boost footsie stocks,1
poor batter meat ratio made chicken tenders unsatisfying,0
love ringtones upbeat,1
basically service bad,0
diageo receives reports united spirits financial irregularities involving,0
pearson cut jobs warns profits,0
fantastic food,1
probably hurry go back,0
service fan quick served nice folks,1
server negligent needs made us feel unwelcome would suggest place,0
nutshell restaraunt smells like combination dirty fish market sewer,0
horrible attitudes towards customers talk one customers enjoy food,0
fits comfortably came three sizes earbud tips,1
friends life lifts profits hikes divi ahead proposed aviva takeover,1
really enjoyed eating,1
opportunity today sample amazing pizzas,1
soyo technology sucks,0
beautiful phone,1
tried cape cod ravoli chicken cranberry mmmm,1
mistake,0
found place accident could happier,1
cable looks thin flimsy scary,0
please dont waste money,0
fit,0
great little item,1
easyjet dismisses lufthansa plan contest germany,0
love device,1
update trader shares leap uk biggest private listing,1
one nice thing added gratuity bill since party larger expect tip,1
would recommend place,0
might gotten defect would risk buying built quality alone,0
valeant astrazeneca strike psoriasis drug deal,1
pricing bit concern mellow mushroom,0
service good company better,1
intercontinental hotels group share price climbs special dividend,1
lloyds cut jobs part restructuring strategy,0
place deserves one star food,0
buy arm holdings plc bhp billiton plc today,1
wanted leave,0
tesco closes new chairman dixons carphone john allan frame,1
someone shouldve invented sooner,1
also feel like chips bought made house,0
overall great experience,1
payout bp oil spill settlement tops billion,0
keyboard nice compromise full qwerty basic cell phone number keypad,1
crown castle buys tower development corp million,1
lasted one day blew,0
allergy warnings menu waitress absolutely clue meals contain peanuts,0
delicious nyc bagels good selections cream cheese real lox capers even,1
service meh,0
holster arrived match photo ad,0
food came good pace,1
ordered lemon raspberry ice cocktail also incredible,1
price good free shipping good purchase,1
screen get smudged easily touches ear face,0
insurers admiral blows hot cold aviva soars life merger,1
bg group still happy shell billion offer,1
get pay guess,0
instructions explain microphone jack could used,0
food arrives meh,0
good food great,1
overall impressed would go back,0
bartender also nice,1
crust good,0
item worked great broke months use,0
arm profits sales shift away mobile gains pace,1
probably never coming back would recommend,0
bad food damn generic,0
think running back carly anytime soon food,0
sides delish mixed mushrooms yukon gold puree white corn beateous,1
coming like experiencing underwhelming relationship parties ca wait person ask break,0
great food,1
echo problem unsatisfactory,0
ear buds play music one ear,0
boyfriend tried mediterranean chicken salad fell love,1
extremely slow takes forever anything,0
lloyds bank said face potential fine handling insurance complaints,0
dont waste money,0
delicious,1
activist fund tci backs german takeover london stock exchange,1
uk christmas power demand lowest years national grid,0
highly recommend case,1
arm buoyed race build internet things,1
trlpc crh backs lafarge holcim asset buy bln euro bridge loan,1
ftse edges investors cheer kingfisher results,1
read reviews problem,1
purchased family friends enjoy clarity ease use,1
comfort whole family,1
bought mainly charger broke soon purchasing,0
returning,0
always evening wonderful food delicious,1
mic great,1
uk winners losers aviva friends life lead ftse gainers,1
meggitt share price tumbles profit falls year,0
love look feel samsung flipphones,1
pretty satifying experience,1
peroni grolsch put sale ab inbev plans acquisition sabmiller,1
frog phone charm adorable eye catching,1
provides good protection looks classy,1
good worked started problems auto reverse tape player,0
received orders well within shipping timeframe everything good working order overall excited source,1
canadian pension fund borealis renews pursuit severn trent report,1
happened next pretty putting,0
battery works great,1
charge,0
like fact rests lightly ear rather inside,1
back,0
staley face challenges barclays,0
astrazeneca patent asthma drug invalidated us court,0
bought mother problem battery,0
husband said rude even apologize bad food anything,0
results phone either stuck max volume mute,0
worst piece crap ever along verizon customer service,0
holds charge long time reasonably comfortable conditions quality sound tremendous,1
reception headset excellent,1
claims start year,1
definitely soon,1
turnaround buys bhp billiton plc home retail group plc,1
great phone,1
britain ftse bounces back mondi barratt lead,1
love fact everything menu worth,1
impressed concept food,0
car charger well ac charger included make sure never run recommended,1
perhaps phone defective people hear use,0
astrazeneca teams daiichi sankyo sell movantik us,1
sadly gordon ramsey steak place shall sharply avoid next trip vegas,0
hole wall great mexican street tacos friendly staff,1
still waiting sure item would work ever recieve,0
husband ate lunch disappointed food service,0
analysis copper market may get supply shock glencore closures,0
quit working used months purchased another one best headset ever owned,1
however needed better instructions,0
little device transformed organizational capability made life whole lot easier,1
redeeming quality restaurant inexpensive,1
cheap feel look cheap,0
food really good got full petty fast,1
waste bucks,0
sashimi poor quality soggy tasteless,0
chefs friendly good job,1
light easy use clear reception transmission,1
australia clears ab inbev billion sabmiller buyout plan,1
love put food nice plastic containers opposed cramming little paper takeout boxes,1
customize order way like usual eggplant green bean stir fry love,1
buffet small food offered bland,0
sainsbury chief warns squeeze high street retailers,0
glencore sells agriculture stake,1
del taco pretty nasty avoided possible,0
ordered duck rare pink tender inside nice char outside,1
rio approves billion oyu tolgoi copper mine expansion,1
leather nice soft fit tight cut face good shape,1
exchanged phone even problem,0
city spirits sink diageo comes short sales slide,0
britain power supplies enough meet winter demand national grid,1
pearson expects return growth year,1
glencore shares enjoy hong surge,1
warren buffett berkshire hathaway buys stake apple,1
britain ftse hits low financials tesco fall,0
works great,1
persimmon reports strong trading despite eu vote planning delays,1
pleased,1
father battery dying,0
glaxosmithkline heart drug flops study shingles vaccine track,0
know make,1
ftse hits low financials tesco fall,0
rather eat airline food seriously,0
industry makes start year new impairments,1
phenomenal food service ambiance,1
going first negatively review product,0
waitress little slow service,0
like loud buzzing override conversations phone,0
disappointing,0
came back cold,0
good service clean inexpensive boot,1
leopard print wonderfully wild,1
loved place,1
sucked stuff work phone,0
know big deal place wo back,0
credit checker experian reports fall profit,0
owner really great people,1
work hospitality industry paradise valley refrained recommending cibo longer,0
happy good quality low price,1
britain ftse slips high sky falls,0
kind flops around,0
pretty gross,0
riingtones best neither games,0
two years left contract hate phone,0
bland liking place number reasons want waste time bad leave,0
arm holdings plc partners international business machines drive,1
atmosphere modern hip maintaining touch coziness,1
ended sliding edge pants back pockets instead,1
servers went back forth several times even much helped,0
stars aligned ab inbev megabrew merger plan,1
color even prettier thought would graphics incredibly sharp,1
london midday briefing kingfisher french expansion hits rocks,0
waiting hour seated greatest moods,0
good transmit audio,1
ca upload ringtones third party,0
really impressive place closed,0
like nokia either,0
trying make call exercise frustration,0
buy product,0
looking good quality motorola headset keep looking,0
uk government call sell shares royal bank scotland group plc,0
weir leads ftse lower oil price profits warning,0
last time buying,0
work listening music cingular,0
old mutual share price wealth unit seen company,1
headset works great packaged nicely avoid damage,1
bae systems cuts earnings target jobs,0
worst experience ever,0
found six inch long piece wire salsa,0
otherwise easy install use clear sound,1
years bp spill changed offshore drilling,0
camera color balance awful,0
rave reviews could wait eat disappointment,0
impressed product,0
would come back sushi craving vegas,1
easyjet leads britain ftse lower global bond rout resumes,0
checked everywhere feature really disappointing,0
due fact took minutes acknowledged another minutes get food kept forgetting things,0
poor quality,0
bought battery coupon amazon happy purchase,1
wpp boosts sales despite cautious clients,1
case flimsy piece plastic front side protection whatsoever,0
seriously believe owner many unexperienced employees running around like chickens heads cut,0
item match picture,0
ring good phone,1
personally love hummus pita baklava falafels baba ganoush amazing eggplant,1
trouble brewing legal general group plc aviva plc,0
london stock exchange group quarterly revenue rises percent,1
philippines san miguel says partner kirin bids sabmiller,1
bad experience,0
pfizer cut jobs closure cambridge r centre,0
like,0
waste time,0
disappointing accessory good manufacturer,0
impressed headset plantronics,1
problems wit hit dropping signal,0
phone crashed completely get replaced,0
really nothing postinos hope experience better,0
service sucks,0
news feedftse movers lse surges ice says mulling offer ashtead barclays tank,1
sse share price peterhead station supply voltage support national grid,1
restaurant clean family restaurant feel,1
prudential knocked investors withdraw g,0
tried units failed within pros,0
sharm travel disruption british airways easyjet thomson,0
royal mail workers union agree pay deal,1
stupid keep buying new chargers car chargers cradles headphones car kits every time new phone comes,0
left frustrated,0
pearson talks sell stake economist group,1
lastly mozzarella sticks best thing ordered,1
buy dyax bln,1
excellent product price,1
would take long describe bad customer service experience amazon,0
government sell remaining stake royal mail,0
check voice mail night keypad backlight turns seconds first message lost,0
gotten lot compliments,1
dbs julius baer emerge potential bidders barclays asia wealth unit,1
sale tesco clubcard business wpp verge collapse,0
absolute must visit,1
love thing,1
bhp billiton slashes dividend posts billion net loss,0
however year fliptop started get loose wobbly eventually screen went black could receive place calls,0
menu always changing food quality going service extremely slow,0
portion huge,1
best tacos town far,1
definitely worth venturing strip pork belly return next time vegas,1
great ipods,1
returned hours later,0
news feedftse movers lse surges ice says mulling offer ashtead barclays tank,0
service thought good,1
wear everyday holds well,1
ordered sony ericsson think worked thats first used,0
failure leadership behind tesco troubles says former ceo leahy,0
never dining place,0
battery life highly unacceptable,0
service terrible though,0
companiesastrazeneca wins nod hopeful,1
food excellent service good,1
even dropped phone stream submerged seconds still works great,1
works fine,1
royal mail johnson matthey lead ftse lower,0
aviva g suspend property funds investors panic,0
pretty easy,1
food good typical bar food,1
regular stop trips phoenix,1
old mutual faces backlash chief exec payout plan,0
also serve indian naan bread hummus spicy pine nut sauce world,1
also best cheese crisp town,1
screen size big key pad lit well enough camera quality excellent camera phone,1
standard chartered shares jump since upgrades,1
wpp revenue rises quick facts,1
berkshire discloses unit ties iran opens probe,0
enjoy pizza brunch,1
food good,1
iag closes aer lingus increased offer,1
bg group ships first lng queensland curtis,1
one simply disappointment,0
little geeky think thats sex toast rocks oozes sex right battery embedded sleek stylish leather case,1
fda approves astrazeneca drug advanced lung cancer,1
def coming back bowl next time,1
felt insulted disrespected could talk judge another human like,0
update tullow says makes new oil find kenya,1
miss wish one philadelphia,1
warm feeling service felt like guest special treat,1
bus boy hand rude,0
sat another ten minutes finally gave left,0
four former barclays bankers jailed libor,0
standard life share price group gets approval hike stake india jv,1
needless say never back,0
also taste mom pumpkin pancakes pecan butter amazing fluffy delicious,1
china cnpc unveil oil alliance sources,1
really recommend place go wrong donut place,1
companies severn trent expects costs hit inflation,0
started review two stars editing give one,0
admiral group posts decline earnings,0
tesco share price dips blinkbox books closes ending supermarket digital,0
would advise purchase item never worked well,0
bread made,1
tesco share price dips blinkbox books closes ending supermarket digital,0
buffett berkshire builds deere stake dumps exxon,1
took back money got outta,0
server fantastic found wife loves roasted garlic bone marrow added extra meal another marrow go,1
gsk novartis complete deals reshape drugmakers,1
work bougth working,0
companiessmith nephew flops foot ftse,0
design might ergonomic theory could stand ear,0
update sees better first half lower fuel bill,1
nice quality build unlike cheap,1
completely grossed,0
awesome,1
got food apparently never heard salt batter fish chewy,0
google fiber buy webpass big city internet service,1
great time family dinner sunday night,1
grandmother make roasted chicken better one,0
fantastic service,1
great phone,1
sir ken morrison taken stake rival sainsbury,1
used bitpim free program find internet transfer data price cable excellent,1
good quality though,1
sabmiller buys meantime quench thirst craft beer,1
hargreaves landown slides trading update,0
eu regulators clear ab inbev sabmiller deal,1
legal general arm buys pct stake mediacityuk manchester,1
happy far,1
good audio quality,1
good battery got really fast,1
work,0
best headset ever,1
impressed price cases,1
opens battery connection broken device turned,0
service exceptional food good reviews,1
cow tongue cheek tacos amazing,1
diageo carlsberg hit russians suffer oil price collapse rouble,0
restaurant atmosphere exquisite,1
favor stay away dish,0
went happy hour great list wines,1
another note phone appearance really looks rather bland especially black model,0
tesco share price korean currency slide may hit homeplus sale plans,0
disappointing,0
worst customer service,0
watch preparing delicious food,1
however ear pads come easily one week lost one,0
british american tobacco sales hurt currency moves,0
ruling sets lower limit potential fine bp,0
barclays executive harrison denies knowledge libor fixing,0
stanchart announces billion plan posts loss,0
im surprised good quality car charger much reviews,1
received headset good time happy,1
us doj antitrust unit subpoenas mylan pricing doxycycline,0
got car charger even week charger broken went plug started smoking,0
south africa approves sabmiller coke bottling deal conditions,1
oilfield services firm petrofac debt shoots per cent,0
also new problem,0
received pita huge lot meat thumbs,1
server nice even though looked little overwhelmed needs stayed professional friendly end,1
buy different phone,0
evening drastically sick,0
works like charm work one got phone,1
hot sour egg flower soups absolutely stars,1
wo going back,0
think instructions provided helpful,0
astrazeneca acquires zs pharma billion deal,1
tesco share price grocer faces sfo investigation outcome,0
plastic breaks really easy clip,0
pros camera nice pictures also cool styles like black white,1
investors remain skeptical deal,0
food delicious,1
make mistake,0
overall think would take parents place made similar complaints silently felt,0
news feedftse movers standard chartered lifted astrazeneca sinks,0
pancake also really good pretty large,1
still infatuated phone,1
opened sandwich impressed good way,0
first visit hiro delight,1
glencore refinance debt early shares rise,1
ensure compliance petrobras bribery report,0
really really good rice time,1
assure wo disappointed,1
sat right time server get go fantastic,1
wpp wins race buying agency essence digital,1
persimmon sells houses,1
case great works fine,1
good selection food including massive meatloaf sandwich crispy chicken wrap delish tuna melt tasty burgers,1
plethora salads sandwiches everything tried gets seal approval,1
tesco leads leap ftse marks spencer drops,0
shifting bubbling peeling even scratch nothing could happier new one droid,1
left stomach ache felt sick rest day,0
really good product,1
patio seating comfortable,1
none new ones ever quite worked properly,0
ab inbev offers sell sabmiller brands,1
headphones great find think perhaps best purchase made last several years seriously,1
owner used work nobu place really similar half price,1
ocbc buy barclay wealth management unit singapore hong kong,1
shire sees baxalta deal closing expected new rules,1
minutes wait got table,0
especially love long battery life,1
positive note server attentive provided great service,1
good side staff genuinely pleasant enthusiastic real treat,1
software great job could also make ringtones form existing cds without internet connection,1
zurich insurance considering offer uk rival rsa insurance,1
try airport experience tasty food speedy friendly service,1
friend loved salmon tartar,1
update director accused us illegal tips plumber,0
everything,1
poor sound quality,0
love bluetooth,1
top news barclays profit depressed foreign exchange provisions,0
doubts grow glaxosmithkline bln capital return plan,0
table service pretty fast,1
shire offers buy baxalta billion,1
fda panel backs glaxo asthma drug adults adolescents,1
really like crepe station,1
kingfisher share price slides cost implement new strategy,0
hands best phone ever,1
wins billion order emirates airline,1
aberdeen posts outflows says conditions remain challenging,0
definitely go back,1
barclays fined failings,0
better atmosphere,0
fits comfortably either ear sound clear loud charge lasts couple days,1
overall disappointed quality food bouchon,0
bad quality,0
food tasty say real traditional hunan style,0
complaints,1
usable keyboard actually turns pda useful machine instead neat gadget,1
wait minutes get drink longer get arepas,0
need two hands operate software interface decade old compete new software designs,0
dont buy,0
tesco pay million settle us lawsuit,0
peroni grolsch put sale ab inbev plans acquisition sabmiller,1
attached gas station rarely good sign,0
persimmon shares nudge higher housebuilder sees strong,1
tragedy struck,0
recognizes phone storage device,0
works fine motorola cellphone lot better battery,1
summary largely disappointing dining experience,0
servers suck wait correction server heimer sucked,0
none tones acceptable,0
light plenty battery capacity confortable wear somewhat extended periods time,1
british american tobacco drops sues pwc pollution scandal,0
food really boring,0
pizza tasted old super chewy good way,0
would recommend others,1
hsbc chief hit scandal,0
glaxosmithkline rebound gathering pace says outgoing ceo,1
buyers remorse one,0
time side restaurant almost empty excuse,0
research development division obviously knows,1
stay vegas must get breakfast least,1
waaaaaayyyyyyyyyy rated saying,0
disappointed ordered big bay plater,0
atmosphere great lovely duo violinists playing songs requested,1
wow loved place,1
love one authentic japanese cool dude,1
sabmiller buys meantime quench thirst craft beer,1
glaxo viiv healthcare signs china manufacturing deal desano,1
case passed one year mark shows signs wear functional,1
wpp world largest ad agency reports strong growth,1
best buffet town price beat,1
buy dyax bln,1
also combos like burger fries beer decent deal,1
centrica suffers protest shareholders pay,0
work,0
drivng along headset starts ringing reason,0
like reviewer said could pay eat place,0
nine banks including barclays citi agree pay billion settle forex,0
enough volume,0
mongolia rio tinto agree oyu tolgoi mine expansion,1
crêpe delicate thin moist,1
market report aviva tops market traders approve choice friends,1
feels poorly constructed menus difficult navigate buttons recessed difficult push,0
promptly greeted seated,1
pair headphones worst ever,0
wife hated meal coconut shrimp friends really enjoy meals either,0
highlights great quality nigiri,1
ca tell disappointed,0
love pho spring rolls oh yummy try,1
block amazing,1
shell plans shed jobs buying bg group,0
ripped banana ripped petrified tasteless,0
self proclaimed coffee cafe wildly disappointed,0
comfortable wear well probably important aspect using case,1
tesco shares jump christmas sales beat expectations,1
rated,0
great place highly recommend,1
great way finish great,1
comfortable fit need headset comfortable least hour time entire day,1
glad found place,1
hold charge,0
uk ftse climbs record closing high standard chartered surges,1
teva fda approves generic version astrazeneca heartburn drug,1
terrible service,0
awkward use unreliable,0
used dirty,0
overall like place lot,1
steaks well trimmed also perfectly cooked,1
probably dirt,0
bought nokia cell phone weeks ago nightmare,0
worked perfectly,1
highly recommend device everyone,1
standard chartered shifts strategy losses,0
jabra ear gels r best,1
tried like place times think done,0
